ticker|date|title|body
DTAC|12312017|UPDATE 3-Thai telcos sit out $3.5 bln spectrum auction  regulator to review process |* All 3 Thai mobile operators to give 1800 Mhz auction a miss
GLOW|12312017|BRIEF-Glowpoint Announces Qtrly Loss Per Share $0.03 |* QTRLY LOSS PER SHARE $0.03 Source text for Eikon: Further company coverage: (Reuters.Briefs@thomsonreuters.com)
PS|12312017|BRIEF-Pluralsight Says IPO Of 20.7 Mln Shares Priced At $15 per Share |* SAYS INITIAL PUBLIC OFFERING OF 20.7 MILLION SHARES PRICED AT $15.00PER SHARE Source text for Eikon: Further company coverage:
PTT|12312017|Thai regulator blocks $4 billion sale of Engie's Glow to PTT |BANGKOK Thailand's energy regulator has blocked PTT Pcl's  bid to acquire power firm Glow Energy  from France's Engie  for up to $4 billion  in what would have been the country's largest investment deal this year.
TRUE|12312017|BRIEF-Truecar Reports Q1 Loss Per Share Of $0.09 |* Q1 EARNINGS PER SHARE VIEW $0.01 -- THOMSON REUTERS I/B/E/S
